{
  "$schema": "./local-agent-mission.graph.schema.json",
  "id": "swarm-dao-local-agent-mission",
  "version": 1,
  "scope": "macos-local-shared-mission-thread",
  "milestone": "m1-model-review",
  "platform": {
    "kind": "native-macos",
    "preferredUi": "SwiftUI",
    "executionBoundary": "local-mac",
    "projectBoundary": "distinct-monorepo-project"
  },
  "authority": {
    "missionState": "mission-machine",
    "agentState": "agent-machine",
    "subagentRequestState": "subagent-request-machine",
    "policyOverrideState": "policy-override-machine",
    "llm": "signal-only",
    "freeFormTextTransitions": false
  },
  "eventSources": ["human", "ai", "system", "tool"],
  "entities": [
    {
      "id": "team-template",
      "mutability": "append-only-revisions",
      "requiredFields": [
        "templateId",
        "revision",
        "origin",
        "name",
        "agents",
        "createdBy",
        "createdAt"
      ],
      "commands": ["CREATE_TEMPLATE", "SAVE_TEMPLATE_REVISION", "DUPLICATE_TEMPLATE"],
      "invariants": [
        "built-in revisions are immutable",
        "saving an edit creates a new revision",
        "duplicating creates a new templateId with lineage",
        "templates never carry mission runtime state"
      ]
    },
    {
      "id": "mission-template-snapshot",
      "mutability": "immutable-after-launch",
      "requiredFields": [
        "snapshotId",
        "missionId",
        "sourceTemplateId",
        "sourceRevision",
        "normalizedTeam",
        "autonomyContract",
        "contentHash",
        "sealedAt"
      ],
      "commands": ["SEAL_MISSION_TEMPLATE_SNAPSHOT"],
      "invariants": [
        "one snapshot belongs to exactly one mission",
        "launch is rejected without a snapshot hash",
        "later template revisions cannot change a launched mission",
        "the autonomy contract is structured and contains no free-form transition instruction"
      ]
    },
    {
      "id": "mission-message",
      "mutability": "append-only",
      "requiredFields": [
        "messageId",
        "missionId",
        "author",
        "visibility",
        "kind",
        "content",
        "createdAt"
      ],
      "commands": ["APPEND_HUMAN_MESSAGE", "APPEND_AGENT_MESSAGE", "APPEND_SYSTEM_NOTICE"],
      "invariants": [
        "M1 accepts only mission_shared visibility",
        "the visibility envelope already supports mission_shared or direct",
        "direct visibility is rejected with feature_not_enabled in M1",
        "raw prompts, chain-of-thought, stdout, stderr, tool payloads, stack traces, tokens and secrets never enter the shared thread",
        "subagent refusals and human-validation requests create visible system notices"
      ]
    },
    {
      "id": "agent-record",
      "mutability": "state-machine-plus-append-only-activity",
      "requiredFields": [
        "agentId",
        "missionId",
        "role",
        "state",
        "effectivePermissions",
        "parentAgentId",
        "capabilities",
        "activityJournal"
      ],
      "commands": ["APPEND_AGENT_ACTIVITY"],
      "invariants": [
        "every agent belongs to exactly one mission",
        "parentAgentId is null only for top-level agents",
        "parent and child belong to the same mission",
        "the activity journal is technical and is not rendered as shared-thread content",
        "chain-of-thought and secrets are never persisted in the activity journal"
      ]
    },
    {
      "id": "autonomy-contract",
      "mutability": "immutable-base-plus-expiring-overrides",
      "requiredFields": [
        "allowedToolIds",
        "budgetLimits",
        "delegationLimits",
        "fileAccessRules",
        "validationThresholds",
        "retryLimits"
      ],
      "commands": ["VALIDATE_AUTONOMY_CONTRACT"],
      "invariants": [
        "all policy dimensions are structured",
        "missing dimensions fail closed",
        "the launch contract cannot exceed effective policy",
        "runtime overrides do not mutate the sealed base contract"
      ]
    },
    {
      "id": "decision-journal-entry",
      "mutability": "append-only",
      "requiredFields": [
        "entryId",
        "missionId",
        "aggregateType",
        "aggregateId",
        "eventType",
        "source",
        "accepted",
        "reasonCode",
        "occurredAt",
        "sequence"
      ],
      "commands": ["APPEND_DECISION_JOURNAL_ENTRY"],
      "invariants": [
        "accepted and rejected events are journaled",
        "sequence is strictly monotonic per mission",
        "timestamps are injected and never read by a pure model guard",
        "payloads are redacted before persistence"
      ]
    }
  ],
  "policyModel": {
    "layers": [
      {
        "id": "system-ceilings",
        "priority": 1,
        "mutable": false,
        "missionOverrideable": false
      },
      {
        "id": "application-global-rules",
        "priority": 2,
        "mutable": true,
        "missionOverrideableByField": true
      },
      {
        "id": "mission-autonomy-contract",
        "priority": 3,
        "mutable": false,
        "missionOverrideableByField": true
      },
      {
        "id": "confirmed-mission-overrides",
        "priority": 4,
        "mutable": false,
        "missionOverrideableByField": false
      }
    ],
    "dimensions": [
      "allowedToolIds",
      "budgetLimits",
      "delegationLimits",
      "fileAccessRules",
      "validationThresholds",
      "retryLimits"
    ],
    "evaluationOrder": [
      "reject malformed or incomplete facts",
      "reject any system-ceiling violation",
      "apply global rules",
      "apply the sealed mission autonomy contract",
      "apply only active, exact-scope, human-confirmed mission overrides",
      "re-check system ceilings",
      "reserve budget atomically",
      "emit allow, requires_human_confirmation or deny with reason codes"
    ],
    "invariants": [
      "system ceilings can never be relaxed",
      "a field marked non-overrideable can never be relaxed for a mission",
      "an override is bound to one mission, one exact policy diff and one human principal",
      "an override expires when its mission reaches a terminal state",
      "allowlists are intersected unless an eligible active override explicitly expands an overrideable lower layer",
      "numeric maxima never exceed the system ceiling",
      "file paths are canonicalized by a trusted tool and checked against read and write roots separately",
      "symlink or path-resolution uncertainty fails closed",
      "budget reservation and consumption are atomic and append-only",
      "global rules are append-only revisions and every authorization is bound to the evaluated revision",
      "a tighter global revision applies to the next uncommitted effect while a looser revision never expands a sealed mission contract implicitly",
      "an AI signal cannot contain a permission grant, override confirmation or policy verdict"
    ]
  },
  "machines": [
    {
      "id": "mission-machine",
      "initial": "draft",
      "states": [
        { "id": "draft", "terminal": false },
        { "id": "pending", "terminal": false },
        { "id": "active", "terminal": false },
        { "id": "pausing", "terminal": false },
        { "id": "paused", "terminal": false },
        { "id": "human_intervention_required", "terminal": false },
        { "id": "cancelling", "terminal": false },
        { "id": "failing", "terminal": false },
        { "id": "completed", "terminal": true },
        { "id": "cancelled", "terminal": true },
        { "id": "failed", "terminal": true }
      ],
      "events": [
        { "type": "MISSION_DRAFT_UPDATED", "sources": ["human"] },
        { "type": "MISSION_LAUNCH_REQUESTED", "sources": ["human"] },
        { "type": "MISSION_ACTIVATION_EVALUATED", "sources": ["system"] },
        { "type": "MISSION_PAUSE_REQUESTED", "sources": ["human"] },
        { "type": "MISSION_PAUSE_QUIESCENCE_EVALUATED", "sources": ["system"] },
        { "type": "MISSION_RESUME_REQUESTED", "sources": ["human"] },
        { "type": "AGENT_SIGNAL_RECORDED", "sources": ["ai"] },
        { "type": "MISSION_HUMAN_INTERVENTION_REQUIRED", "sources": ["system"] },
        { "type": "MISSION_INTERVENTION_EVALUATED", "sources": ["system"] },
        { "type": "MISSION_COMPLETION_EVALUATED", "sources": ["system"] },
        { "type": "MISSION_CANCEL_REQUESTED", "sources": ["human"] },
        { "type": "MISSION_FAILURE_RECORDED", "sources": ["system", "tool"] },
        { "type": "MISSION_QUIESCENCE_EVALUATED", "sources": ["system"] },
        { "type": "HUMAN_MESSAGE_SUBMITTED", "sources": ["human"] }
      ],
      "transitions": [
        {
          "id": "M01",
          "from": ["draft"],
          "event": "MISSION_DRAFT_UPDATED",
          "guard": "ownerAndStructuredDraft",
          "to": "draft",
          "effects": ["persistMissionDraft", "journalDecision"]
        },
        {
          "id": "M02",
          "from": ["draft"],
          "event": "MISSION_LAUNCH_REQUESTED",
          "guard": "ownerValidTemplateValidContractNoUnconfirmedOverrides",
          "to": "pending",
          "effects": [
            "sealMissionTemplateSnapshot",
            "createTopLevelAgentRecords",
            "requestTopLevelAgentStarts",
            "journalDecision"
          ]
        },
        {
          "id": "M03",
          "from": ["pending"],
          "event": "MISSION_ACTIVATION_EVALUATED",
          "guard": "allRequiredTopLevelAgentsActive",
          "to": "active",
          "effects": ["appendMissionActivatedNotice", "journalDecision"]
        },
        {
          "id": "M04",
          "from": ["pending"],
          "event": "MISSION_ACTIVATION_EVALUATED",
          "guard": "startupNeedsHumanIntervention",
          "to": "human_intervention_required",